{
  "schema": "source-evidence-index/v1",
  "owner": {
    "id": "source-release/v1",
    "path": "agent-workflows/manifests/source-release.json",
    "compiler": "ai_agent_workflow.source_release.SourceReleaseV1"
  },
  "ordering": "catalog-groups-then-catalog-profiles-then-surface-manifest",
  "entry_count": 94,
  "entries": [
    {
      "id": "group.A.A1",
      "name": "bootstrap-classify-environment",
      "kind": "skill",
      "source": {
        "path": "agent-workflows/skills/bootstrap-classify-environment/SKILL.md",
        "digest": "sha256:de13657f7209eaafad3373d812b37465206fa235416abfb8ea21dcc94147f103"
      },
      "test_selector": "agent-workflows/tests/test_bootstrap_contracts.py::A1_EnvironmentInventoryTests",
      "evidence": {
        "path": "agent-workflows/evidence/contracts/A1.json",
        "digest": "sha256:dcbaf44748733eb38737d16100c53caeafd5527e0e00758d09bc1c1eac43f996",
        "result": "passed"
      },
      "reachability": [
        {
          "kind": "group-composition",
          "id": "agent-workflows.group.A",
          "path": "agent-workflows/groups/bootstrap.json",
          "digest": "sha256:a20a031d2f2f3168fe036cf640d51408d669aca6fd04ad8df7b10ff50a16ab52"
        },
        {
          "kind": "workflow",
          "id": "bootstrap-new-workflow",
          "path": "agent-workflows/workflows/bootstrap-new-workflow.json",
          "digest": "sha256:1ec98e9834085d718ec0464b7be80334a328ea621e82e2fce1264ff26c65e6c1",
          "stage_id": "bootstrap"
        }
      ]
    },
    {
      "id": "group.A.A2",
      "name": "bootstrap-isolate-workspace",
      "kind": "skill",
      "source": {
        "path": "agent-workflows/skills/bootstrap-isolate-workspace/SKILL.md",
        "digest": "sha256:0a6063bd56e10aba2d3262a9cc7de5c2d0dc1be153798364843139c7f033b39d"
      },
      "test_selector": "agent-workflows/tests/test_bootstrap_contracts.py::A2_WorkspaceIsolationTests",
      "evidence": {
        "path": "agent-workflows/evidence/contracts/A2.json",
        "digest": "sha256:88c53406f109cbba0985e441c50aac5992ee70fa363e76c5b5cba1fe172771ef",
        "result": "passed"
      },
      "reachability": [
        {
          "kind": "group-composition",
          "id": "agent-workflows.group.A",
          "path": "agent-workflows/groups/bootstrap.json",
          "digest": "sha256:a20a031d2f2f3168fe036cf640d51408d669aca6fd04ad8df7b10ff50a16ab52"
        },
        {
          "kind": "workflow",
          "id": "bootstrap-new-workflow",
          "path": "agent-workflows/workflows/bootstrap-new-workflow.json",
          "digest": "sha256:1ec98e9834085d718ec0464b7be80334a328ea621e82e2fce1264ff26c65e6c1",
          "stage_id": "bootstrap"
        }
      ]
    },
    {
      "id": "group.A.A3",
      "name": "bootstrap-design-rollback",
      "kind": "skill",
      "source": {
        "path": "agent-workflows/skills/bootstrap-design-rollback/SKILL.md",
        "digest": "sha256:48960aba99b7f3bb34cb3f56dfa7625519d7ca064ab917f65703d2043d4e16a8"
      },
      "test_selector": "agent-workflows/tests/test_bootstrap_contracts.py::A3_RollbackDesignTests",
      "evidence": {
        "path": "agent-workflows/evidence/contracts/A3.json",
        "digest": "sha256:b88688bf3d44516bebde8d57c224cb8b0499255a3059fa97dc3e2078e42934b9",
        "result": "passed"
      },
      "reachability": [
        {
          "kind": "group-composition",
          "id": "agent-workflows.group.A",
          "path": "agent-workflows/groups/bootstrap.json",
          "digest": "sha256:a20a031d2f2f3168fe036cf640d51408d669aca6fd04ad8df7b10ff50a16ab52"
        },
        {
          "kind": "workflow",
          "id": "bootstrap-new-workflow",
          "path": "agent-workflows/workflows/bootstrap-new-workflow.json",
          "digest": "sha256:1ec98e9834085d718ec0464b7be80334a328ea621e82e2fce1264ff26c65e6c1",
          "stage_id": "bootstrap"
        }
      ]
    },
    {
      "id": "group.A.A4",
      "name": "bootstrap-initialize-run",
      "kind": "skill",
      "source": {
        "path": "agent-workflows/skills/bootstrap-initialize-run/SKILL.md",
        "digest": "sha256:35d81f9f2ed377e593ed37ffae464f5ed95e0e9286fcceb9d6b7b54b6b19007d"
      },
      "test_selector": "agent-workflows/tests/test_bootstrap_contracts.py::A4_RunInitializationTests",
      "evidence": {
        "path": "agent-workflows/evidence/contracts/A4.json",
        "digest": "sha256:04f2e50ea9fa219d4ebab4cb22ef4110769635e30a596126200358516c7b6765",
        "result": "passed"
      },
      "reachability": [
        {
          "kind": "group-composition",
          "id": "agent-workflows.group.A",
          "path": "agent-workflows/groups/bootstrap.json",
          "digest": "sha256:a20a031d2f2f3168fe036cf640d51408d669aca6fd04ad8df7b10ff50a16ab52"
        },
        {
          "kind": "workflow",
          "id": "bootstrap-new-workflow",
          "path": "agent-workflows/workflows/bootstrap-new-workflow.json",
          "digest": "sha256:1ec98e9834085d718ec0464b7be80334a328ea621e82e2fce1264ff26c65e6c1",
          "stage_id": "bootstrap"
        }
      ]
    },
    {
      "id": "group.A.A5",
      "name": "bootstrap-detach-legacy-owner",
      "kind": "skill",
      "source": {
        "path": "agent-workflows/skills/bootstrap-detach-legacy-owner/SKILL.md",
        "digest": "sha256:2b6828daa2789cf310231cb34f9fee9a6b21b12b5d266be8ed0fdab764dbd4ce"
      },
      "test_selector": "agent-workflows/tests/test_bootstrap_contracts.py::A5_LegacyDetachTests",
      "evidence": {
        "path": "agent-workflows/evidence/contracts/A5.json",
        "digest": "sha256:cb6b81710bf90a736fb760e227040810530657f47096ba14a8b45041c8fb22bf",
        "result": "passed"
      },
      "reachability": [
        {
          "kind": "group-composition",
          "id": "agent-workflows.group.A",
          "path": "agent-workflows/groups/bootstrap.json",
          "digest": "sha256:a20a031d2f2f3168fe036cf640d51408d669aca6fd04ad8df7b10ff50a16ab52"
        },
        {
          "kind": "workflow",
          "id": "bootstrap-new-workflow",
          "path": "agent-workflows/workflows/bootstrap-new-workflow.json",
          "digest": "sha256:1ec98e9834085d718ec0464b7be80334a328ea621e82e2fce1264ff26c65e6c1",
          "stage_id": "bootstrap"
        }
      ]
    },
    {
      "id": "group.A.A6",
      "name": "bootstrap-build-walking-skeleton",
      "kind": "skill",
      "source": {
        "path": "agent-workflows/skills/bootstrap-build-walking-skeleton/SKILL.md",
        "digest": "sha256:5746e91d41ac3297cbb30bf88fe7c9846aa278c798763dba13167826c47bb133"
      },
      "test_selector": "agent-workflows/tests/test_walking_skeleton.py::A6_WalkingSkeletonTests",
      "evidence": {
        "path": "agent-workflows/evidence/contracts/A6.json",
        "digest": "sha256:7366d75dea974847f82fb1a4d9dd23761a56bea78a2b7b11a38dea7c3bd6cbc2",
        "result": "passed"
      },
      "reachability": [
        {
          "kind": "group-composition",
          "id": "agent-workflows.group.A",
          "path": "agent-workflows/groups/bootstrap.json",
          "digest": "sha256:a20a031d2f2f3168fe036cf640d51408d669aca6fd04ad8df7b10ff50a16ab52"
        },
        {
          "kind": "workflow",
          "id": "bootstrap-new-workflow",
          "path": "agent-workflows/workflows/bootstrap-new-workflow.json",
          "digest": "sha256:1ec98e9834085d718ec0464b7be80334a328ea621e82e2fce1264ff26c65e6c1",
          "stage_id": "bootstrap"
        }
      ]
    },
    {
      "id": "group.A.A6R",
      "name": "bootstrap-migrate-control-kernel",
      "kind": "skill",
      "source": {
        "path": "agent-workflows/skills/bootstrap-migrate-control-kernel/SKILL.md",
        "digest": "sha256:6301f4adeff6cbdc4d49e25bcce0e647fd8f05ce3adc278eaf86decde96fed59"
      },
      "test_selector": "agent-workflows/tests/test_a6r_evidence.py::A6R_EvidenceTests",
      "evidence": {
        "path": "agent-workflows/evidence/contracts/A6R.json",
        "digest": "sha256:1eb28fc0dffed9e3eb8f764853a6096f5910129d185ebf66f42fdc576c31cf5e",
        "result": "passed"
      },
      "reachability": [
        {
          "kind": "group-composition",
          "id": "agent-workflows.group.A",
          "path": "agent-workflows/groups/bootstrap.json",
          "digest": "sha256:a20a031d2f2f3168fe036cf640d51408d669aca6fd04ad8df7b10ff50a16ab52"
        },
        {
          "kind": "workflow",
          "id": "bootstrap-new-workflow",
          "path": "agent-workflows/workflows/bootstrap-new-workflow.json",
          "digest": "sha256:1ec98e9834085d718ec0464b7be80334a328ea621e82e2fce1264ff26c65e6c1",
          "stage_id": "bootstrap"
        }
      ]
    },
    {
      "id": "group.A.A7",
      "name": "bootstrap-self-host-handoff",
      "kind": "skill",
      "source": {
        "path": "agent-workflows/skills/bootstrap-self-host-handoff/SKILL.md",
        "digest": "sha256:e2b061ee152163b2a3cd5659d240aaa3e28afe3d1af8bedede70a8257722c2fa"
      },
      "test_selector": "agent-workflows/tests/test_a7_self_host_handoff.py::A7_SelfHostHandoffTests",
      "evidence": {
        "path": "agent-workflows/evidence/contracts/A7.json",
        "digest": "sha256:0cb555c81965fefafa07acbd95c049c8d6b8df972d5f5b2d7ce3041f3c59aa67",
        "result": "passed"
      },
      "reachability": [
        {
          "kind": "group-composition",
          "id": "agent-workflows.group.A",
          "path": "agent-workflows/groups/bootstrap.json",
          "digest": "sha256:a20a031d2f2f3168fe036cf640d51408d669aca6fd04ad8df7b10ff50a16ab52"
        },
        {
          "kind": "workflow",
          "id": "bootstrap-new-workflow",
          "path": "agent-workflows/workflows/bootstrap-new-workflow.json",
          "digest": "sha256:1ec98e9834085d718ec0464b7be80334a328ea621e82e2fce1264ff26c65e6c1",
          "stage_id": "bootstrap"
        }
      ]
    },
    {
      "id": "group.B.B1",